{
  "schema_version": "resume-ir.synthetic-smoke-artifact-manifest.v1",
  "goal_id": "resume-ir.performance-gui-loop.2026-06",
  "manifest_kind": "synthetic_smoke_baseline",
  "report_schema_version": "resume-ir.experiment-report.v2",
  "report_kind": "redacted_evidence",
  "evidence_lane": "smoke",
  "claim": "no_claim",
  "contract_pins": {
    "active_goal_sha256": "1580e8111af78df6342e855fb6e4eb59e22aa36629f987dc42e3d3f1455e985e",
    "acceptance_matrix_sha256": "877b5615da11b5d485e14ef3c0ddc1518b6c7932d9277cfefa8eab60b4d4da6e",
    "loop_state_schema_sha256": "66bd37404d9c63f898c1fc6fd5eabb547894a4e2cd2960244367a4926a957e0a",
    "experiment_report_schema_sha256": "f91e49ff12d7347bdfc4deb0b2ca0912f2a8bd18158b68d32260ec79e7a2083e",
    "synthetic_smoke_artifact_manifest_schema_sha256": "b1f5483488e1b7b7e7d46cb8e12cd730281f39b74f14f68fbff49b4781d0a866",
    "git_head_sha": "af81010be9fe762216ff1b9f03913f1f0a1c5c40"
  },
  "privacy": {
    "contains_raw_resume_text": false,
    "contains_raw_query_text": false,
    "contains_candidate_results": false,
    "contains_local_paths": false,
    "contains_tokens": false,
    "contains_diagnostics_package": false,
    "trace_summary_redacted": true
  },
  "report_sha256": "9cc697220fe65a03cbed36719c6cd9d6d956d25f77e7d6a0916744f62d7d91b9",
  "report_size_bytes": 4072,
  "artifacts": [
    {
      "component": "synthetic_query",
      "schema_version": "benchmark.v1",
      "report_sha256": "aaaaaaaaaaaaaaaaaaaaaaaaaaaaaaaaaaaaaaaaaaaaaaaaaaaaaaaaaaaaaaaa",
      "report_size_bytes": 512,
      "target_claim": "not_evaluated"
    },
    {
      "component": "ocr_throughput",
      "schema_version": "ocr-throughput.v1",
      "report_sha256": "bbbbbbbbbbbbbbbbbbbbbbbbbbbbbbbbbbbbbbbbbbbbbbbbbbbbbbbbbbbbbbbb",
      "report_size_bytes": 448,
      "target_claim": "not_evaluated"
    },
    {
      "component": "vector_quality",
      "schema_version": "vector-quality.v1",
      "report_sha256": "cccccccccccccccccccccccccccccccccccccccccccccccccccccccccccccccc",
      "report_size_bytes": 384,
      "target_claim": "not_evaluated"
    },
    {
      "component": "private_query_runner",
      "schema_version": "benchmark.v1",
      "report_sha256": "dddddddddddddddddddddddddddddddddddddddddddddddddddddddddddddddd",
      "report_size_bytes": 768,
      "target_claim": "not_evaluated"
    }
  ]
}
